{
 "schema_revision": 1,
 "id": "SCF-B-0002",
 "kind": "scaffold",
 "title": "旧ルール群由来の仮のルール集（governance領域）",
 "product": "HELIX-OS",
 "owner_candidate": "HELIX-OS 管理（規則と検査の対応を保つ。RUL-OSA-06／RUL-OSI-02の運転側）",
 "state": "active",
 "reason": "要求候補57本（旧ルール群7,622 atom）は未採否で、対象別L2本文・AGENTS／hook・検査定義への正式な接続はL2採否とL3以降を待つ。その間、規則の意味を1件も落とさずgovernance領域に保持し、AI作業者が要求単位で参照できる仮のルール集が必要である。",
 "upstream": [
  {
   "path": "docs/governance/candidates/legacy-rule-derived-requirements.md",
   "sha256": "f647bbbcbe21ef775186760086decac511c6a7845f7575952eb7eb551dd55101",
   "note": "要求候補57本（RUL-*） [2026-09-26 旧HELIXからの移行台帳のlegacy-migration/への移動（PO判断） read-after: docs/governance/candidates/legacy-rule-derived-requirements.mdは、旧HELIXからの移行作業の台帳・待ち行列・wave記録をdocs/governance/直下からdocs/governance/legacy-migration/の種類別フォルダへ移した（2026-09-26のPO判断、docs/governance/decisions/governance-legacy-migration-layout-po-decisions-2026-09-26.md）のに合わせ、移動した台帳・inventoryへのリンク先（相対path）だけを新しいpathへ改めた（文言・行数は不変）。本bindingのrole・obligations・connections・replacement・artifactは、旧HELIXからの移行台帳のpath（旧docs/governance/直下）、それらへのリンクの表記、研究用pinとvalidatorのpath・digestの表記に依存しないことをbinding全体で確認した。前receipt=386e4083f1a47c2d09ea75ea774772421a44b6f5dd9eaa331d6ea773cd683ffa; 現receipt=f647bbbcbe21ef775186760086decac511c6a7845f7575952eb7eb551dd55101; このBindingの採否・authorityは変更しない。]"
  },
  {
   "path": "docs/governance/legacy-migration/rule-atom/legacy-rule-atom-inventory.jsonl",
   "sha256": "d27a7ae55bcf9959264dd3579f906479e236c95e188132a512ff4af2a35c9567",
   "note": "規則atom 7,622件の台帳 [2026-09-26 旧HELIXからの移行台帳のdocs/governance/legacy-migration/への移動（PO判断、docs/governance/decisions/governance-legacy-migration-layout-po-decisions-2026-09-26.md） read-after: 上流pathを旧path=docs/governance/legacy-rule-atom-inventory.jsonlから新path=docs/governance/legacy-migration/rule-atom/legacy-rule-atom-inventory.jsonlへ更新した（POの指示で、旧HELIXからの移行作業の台帳・待ち行列・wave記録をdocs/governance/直下からdocs/governance/legacy-migration/の種類別フォルダへ移した）。本文は不変（同一bytes）。本bindingのrole・obligations・connections・replacement・artifactは、移行台帳の置き場所と相対リンクの表記に依存しないことをbinding全体で確認した。前receipt=97a9e0a4cfd5999f5178ec13f758ef71c334191aac51ed43c3bb9570bd762784; 現receipt=97a9e0a4cfd5999f5178ec13f758ef71c334191aac51ed43c3bb9570bd762784; このBindingの採否・authorityは変更しない。] [2026-10-10 source抽出訂正: RE01-257/258/RG44-006の3文だけを引用原文へ合わせ、旧全recordは docs/governance/audits/source-rebaseline/osa03-rule-source-extraction-correction-2026-10-10.json に保持。主/副ID・件数・要求候補・Binding role/obligations/authorityは不変。rulebookを決定的に再生成して照合する。]"
  },
  {
   "path": "docs/governance/legacy-migration/rule-atom/legacy-rule-atom-source-files.jsonl",
   "sha256": "3514c9b36fa7893ee90de7917ad19a1e5549556b5229ddf7deec3776492f7939",
   "note": "出どころfile 632件 [2026-09-26 旧HELIXからの移行台帳のdocs/governance/legacy-migration/への移動（PO判断、docs/governance/decisions/governance-legacy-migration-layout-po-decisions-2026-09-26.md） read-after: 上流pathを旧path=docs/governance/legacy-rule-atom-source-files.jsonlから新path=docs/governance/legacy-migration/rule-atom/legacy-rule-atom-source-files.jsonlへ更新した（POの指示で、旧HELIXからの移行作業の台帳・待ち行列・wave記録をdocs/governance/直下からdocs/governance/legacy-migration/の種類別フォルダへ移した）。本文は不変（同一bytes）。本bindingのrole・obligations・connections・replacement・artifactは、移行台帳の置き場所と相対リンクの表記に依存しないことをbinding全体で確認した。前receipt=3514c9b36fa7893ee90de7917ad19a1e5549556b5229ddf7deec3776492f7939; 現receipt=3514c9b36fa7893ee90de7917ad19a1e5549556b5229ddf7deec3776492f7939; このBindingの採否・authorityは変更しない。]"
  }
 ],
 "role": "旧ルール群の要求候補と規則atomを、要求単位の仮のルール集として無損失に保持し、参照可能にする",
 "obligations": [
  "台帳の全atomをちょうど1つの要求fileへ主として置き、欠落・重複・余分・置き場違いを0にする。各atomは台帳の全field（規則文、種類、強制、失敗時、旧実装固有の部分、副、出どころ、由来）を写す（govcheck E_LOSS／E_DUP／E_EXTRA／E_PLACE、E_REGEN）",
  "副の対応づけとLEGACY-ONLY（除外理由付き）も落とさない（E_LOSS_SECONDARY、rules/LEGACY-ONLY.md）",
  "要求文と件数を要求候補本文と一致させる（E_REQ／E_COUNT）",
  "ルール集を手で書き換えず、正本から決定的に再生成する（E_REGEN）",
  "正本のrevisionが変わったらstaleにする（E_STALE）",
  "ルール集の存在・参照から、要求の採否・人間承認・AGENTS／hookへの反映・工程完了を生成しない"
 ],
 "connections": {
  "consumers": [
   "AI作業者（要求単位で旧ルールの意味を参照する。指示書としてではなく参照として）",
   "システム群ごとの要求整理Issue（枠 #1858、サービス④ #1854、フルリバース #1852、サービス⑥ #1856、サービス⑦ #1857、OS推進 #1859、OS検収 #1860、OS改善 #1861。index.mdのIssue列が正）と #1864",
   "差し替え台帳 Issue #1866"
  ],
  "dependencies": [
   "python3 標準library",
   "docs/governance/candidates/legacy-rule-derived-requirements.md",
   "docs/governance/legacy-migration/rule-atom/legacy-rule-atom-inventory.jsonl"
  ],
  "boundary": "gen_rulebook と govcheck が書くのは scaffold/governance/ 配下だけ。正本（docs/governance/candidates/、legacy-rule-atom-*.jsonl）、AGENTS.md、CLAUDE.md、hook、設定は書き換えない（上流authority registerへの登録行は人がPRで足す。生成器と検査は触らない）。"
 },
 "operations": {
  "allowed": [
   "python3 scaffold/governance/tools/gen_rulebook.py [--check]",
   "python3 scaffold/governance/tools/govcheck.py"
  ],
  "forbidden": [
   "AGENTS.md／CLAUDE.md／hook／設定へのルールの注入",
   "正本（docs/governance/）の書き換え",
   "archive/legacy-generation-*配下の実行・読込",
   "要求の採否・承認・完了の生成"
  ]
 },
 "artifacts": [
  "scaffold/governance/README.md",
  "scaffold/governance/index.md",
  "scaffold/governance/rules",
  "scaffold/governance/tools/gen_rulebook.py",
  "scaffold/governance/tools/govcheck.py",
  "scaffold/governance/tools/govcheck_selftest.py"
 ],
 "verification": {
  "evidence_kind": "scaffold",
  "scope": [
   "schema_interface",
   "deterministic_behavior",
   "source_revision_stale",
   "negative_case",
   "forbidden_write_scope"
  ],
  "oracles": [
   "scaffold/governance/tools/govcheck.py（無損失・件数一致・再生成一致・stale）",
   "scaffold/governance/tools/govcheck_selftest.py（否定例10件）"
  ],
  "negative_cases": [
   "台帳から1件消してE_EXTRA",
   "ルール集から1行消してE_LOSS",
   "1行を別fileへ複製してE_DUP",
   "1行を別fileへ移してE_PLACE",
   "副の節から1件消してE_LOSS_SECONDARY",
   "要求文の前に行を挿入してE_REQ",
   "要求文を書き換えてE_REQ",
   "ルール集を手で書き換えてE_REGEN",
   "正本を変えてE_STALE",
   "bindingの上流sha256を変えてE_STALE"
  ]
 },
 "replacement": {
  "role_target": "対象別L2本文への要求の採否接続（L2D-S1以降）と、HELIX-OSの規則・検査対応の正式な運転（RUL-OSA-06、RUL-OSI-02）。AGENTS／hook／検査定義への反映はL3以降で導出する",
  "formal_artifacts": [],
  "issue": 1866,
  "status": "pending",
  "transfer": null,
  "target_revisions": {},
  "confirmation_ref": null,
  "confirmation_digest": null
 },
 "created": "2026-09-18",
 "updated": "2026-09-18"
}
