{
  "schema_revision": 1,
  "id": "SCF-B-0175",
  "kind": "scaffold",
  "title": "WR181 OS015 PR-B L5/L8 29件2 class候補",
  "product": "HELIX-OS",
  "owner_candidate": "HELIX-OS OS015 管理record/source projection設計",
  "state": "registered",
  "reason": "PR class design_verification のOS015 L5/L8 pair候補。PR-B時点でPR-A main merge後のL4/L9 bytesをpinし、L5をcommitしてからL8がそのL5 ancestor bytesをpinした。後続PR-CはL9の既存2 composite rowsへL5 source pointerを別PRで追加。",
  "upstream": [
    {
      "path": "docs/helix-os/L3-requirements/functional-requirements.json",
      "sha256": "e86254a35b476ed71ebb112e41ccd2b48f89a8d0393e6495dc11cac7a7cf4e02",
      "note": "L3 F02上流要件。期待値の生成元にはしない。"
    },
    {
      "path": "docs/helix-os/L4-basic-design/management-authority-source-record.json",
      "sha256": "5038893210d772bc46fa75802757a90d9658ec4f427f76adcc3cf8a6702ce96f",
      "note": "PR-A merge revisionの2 composite classification。 以前のpin=9146ffd557bc5da60f79cdcd462578b38edf6ec524143a705ab07eeb34c7997b。候補base 64d3cf3に新15 classと112件のL9 linkを追補後の現在bytes=fff2aa4e0883666d73af98733d32eda7b18a4e6a1bc2ebf6741df1c456c62bf6。新たに独立手動監査した15 classをL4へ追補。既存classとdiagnostic_contractは不変。 以前のpin=fff2aa4e0883666d73af98733d32eda7b18a4e6a1bc2ebf6741df1c456c62bf6。L4へ手動監査根拠の15 class rowsと対応するnegative_class_refsを追加。旧class、F02本文、diagnostic_contractは保持。 現在bytes sha256=a1746eea4b021e6d370fca76125179c38c8c241413044e31984e6b549ed0a38a。 2026-10-30 condition照合後candidate sha256=6613e77d651496efe9d576ce840324050147aca8f785c635ce1a858d6eba7ca8。class conditionをL7 fixed given.inputのphase/pointer/value照合に合わせ明確化。 2026-10-30 #3927 C0573–C0582のL4/L7再導出を反映したclass grouping candidate sha256=5038893210d772bc46fa75802757a90d9658ec4f427f76adcc3cf8a6702ce96f."
    },
    {
      "path": "docs/helix-os/L5-detail-design/management-authority-source-record.json",
      "sha256": "c7d979d397f7ebc9b82b1cb5fa3e32f82737956c6a54adc2080342b729607c7f",
      "note": "PR-Bで33 failure rulesを保持する候補L5 bytes。"
    },
    {
      "path": "docs/helix-os/L7-function-verification/management-authority-source-record.json",
      "sha256": "b2a71c3d2a99c5268275e183f21c2b1bbc4b21ad79d577af42573a079e920a09",
      "note": "29件のfixed given.inputとfixture_inputs。"
    },
    {
      "path": "docs/helix-os/L8-unit-verification/management-authority-source-record.json",
      "sha256": "63fc2084a2a41cce1c84ac0db7a437ce25a0525f9f24d060f47bcf61357aa621",
      "note": "583 rowsを保持し29件だけlinkを追加する候補L8 bytes。"
    },
    {
      "path": "docs/helix-os/L9-integration-verification/management-authority-source-record.json",
      "sha256": "1e2bac6a7cabe48b11ba17736c7081fcbe27c35de79f835c75a1a709d5891b39",
      "note": "PR-A/B時点のL9 bytes hash 392417ce60ff10beed23d1aee27aadc7afaaf4062fb1dc04473325e30ad2c7e5から、PR-Cが既存2 composite rowへL5 /failure_rules/31,/32 pointerを各1件追記した現在のL9 bytes。583 integration_casesと既存class/link/expectationは維持。current sha256=a4a186902d29330d5d88bdb8366e70b8678a31d3e2e750b8e2e7e46e83b5776c。 以前のpin=a4a186902d29330d5d88bdb8366e70b8678a31d3e2e750b8e2e7e46e83b5776c。候補base 64d3cf3に新15 classと112件のL9 linkを追補後の現在bytes=ab875f72dfef9f1afaa72b04dd1c8b341d5fc13c4320c1640f42f58f91798c90。L4の新15 classをL9へ順方向投影し、残112 caseのmaterial_ref/raw inputとnegative_class_refを追加。case expected等583件は不変。 2026-10-30 condition照合後candidate sha256=ab875f72dfef9f1afaa72b04dd1c8b341d5fc13c4320c1640f42f58f91798c90。class conditionをL7 fixed given.inputのphase/pointer/value照合に合わせ明確化。 2026-10-30 #3927 C0573–C0582のL4/L7再導出を反映したclass grouping candidate sha256=1e2bac6a7cabe48b11ba17736c7081fcbe27c35de79f835c75a1a709d5891b39."
    },
    {
      "path": "scaffold/tools/design_verification_checker.py",
      "sha256": "cfd12c5bc4a1dd45351858488b476af0025d35deca7027da35bb1373818b129d",
      "note": "現行document checker。変更せず、明示照合に使用。"
    },
    {
      "path": "scaffold/research/wr181-os015-pr-a-l4-l9-20261030/case-evidence.json",
      "sha256": "46540a6e40238eeee2d3c5f2cb7866ba7035c12217cd0f5fd5344430ecd92cbc",
      "note": "先行独立手動照合29件の原証拠。"
    },
    {
      "path": "scaffold/bindings/SCF-B-0170.json",
      "sha256": "a79c2d79c53d84cc4aacaaaea49a9a3dcdbb193b300330d56fc571885592ab8b",
      "note": "固定入力inventoryとclass形成根拠のbinding。 upstream 4aa01e3 main側の旧pin=a105e1b9978b86c38da0de345936d4c05a836512cd9c651b541e369a5e3efa2a。 candidate側では旧pin=9b925b4ecc8de86841f222c49149cb3e2bb156ae4e1106d90d1feffa95fbe204。その後、SCF-B-0170はL4へ監査由来15 classを追加したcandidateを指し、current sha256=f4b4d666bede7af290ddebc0ca5b7e61d050007e1f2f1b6c15335fccc3bf0771。 prior binding bytes f4b4d666bede7af290ddebc0ca5b7e61d050007e1f2f1b6c15335fccc3bf0771を、L4新15 classとreverse refsを含むSCF-B-0170 bytes a721f60003ebb36d2cd317cce9be5ff510fec938c75d7915b85a1648b27b2038へ追随。merge後のSCF-B-0170 bytesをcurrent pinとして参照する。"
    }
  ],
  "role": "OS015 L5/L8 pair限定候補と29件case linkの静的証拠。",
  "obligations": [
    "PR-Aから形成済みの2 classと29件の独立手動照合をL5/L8へ順方向に対応付ける。",
    "L5 source_pair_pinsはPR-A merge 36947baf69999c99d5370d804d69ee2f3acaed72のL4/L9 bytesを指し、L8は同じpair bytesを指す。",
    "L8 candidate_l5_bytesは到達可能なL5 commit d0b9aadf37a53a182bf6188495771c17fd06e16cとそのpath hashを指す。",
    "既存583 L8 caseのcondition/expected/expected_preservedを保持し、29件のlink fieldだけを追加する。",
    "PR-BはL9を変更しなかった。後続PR-Cは2つのL9 composite class rowsへ対応するL5 source_pointersだけを追記し、他の期待・case refsを保つ。",
    "C0044を含む112件と6 singleton-less classの残件を明記する。"
  ],
  "connections": {
    "consumers": [
      "OS015 L5/L8 pair design verification"
    ],
    "dependencies": [
      "PR-A OS015 L4/L9 merge 36947baf69999c99d5370d804d69ee2f3acaed72",
      "L7 fixed input/manual case evidence"
    ],
    "boundary": "PR-BはOS015 L5/L8 pairのみを記録する。後続PR-CはOS015 L4/L9 pair内のL9 source pointer追記であり、このbindingにはPR-B時点の検証結果を保持する。negative-4wayは112未割当caseと6 singleton-less class不在によりFAIL。"
  },
  "operations": {
    "allowed": [
      "JSON文書・pin・case link・既存期待の静的照合",
      "既存document checkerの明示的照合",
      "scfctl validate / stale",
      "git diff --check"
    ],
    "forbidden": [
      "L9を変更する",
      "既存case expected/conditionを変更する、または他層から生成する",
      "raw inputからfinding/classを実行・算出する",
      "checker/runtime/test/CIを変更または実行する",
      "旧HELIX CLI/runtime/test/CIを実行する"
    ]
  },
  "artifacts": [
    "scaffold/research/wr181-os015-pr-b-l5-l8-20261030/README.md",
    "scaffold/research/wr181-os015-pr-b-l5-l8-20261030/validate_static_projection.py",
    "scaffold/research/wr181-os015-pr-b-l5-l8-20261030/static-validation.json",
    "scaffold/research/wr181-os015-pr-b-l5-l8-20261030/verification-summary.json",
    "scaffold/bindings/SCF-B-0170.json"
  ],
  "verification": {
    "evidence_kind": "scaffold",
    "scope": [
      "schema_interface",
      "source_revision_stale",
      "negative_case",
      "forbidden_write_scope"
    ],
    "oracles": [
      "python3 scaffold/research/wr181-os015-pr-b-l5-l8-20261030/validate_static_projection.py",
      "python3 scaffold/tools/design_verification_checker.py check-child --root . --l4 docs/helix-os/L4-basic-design/management-authority-source-record.json --l5 docs/helix-os/L5-detail-design/management-authority-source-record.json --l8 docs/helix-os/L8-unit-verification/management-authority-source-record.json --l9 docs/helix-os/L9-integration-verification/management-authority-source-record.json",
      "python3 scaffold/tools/design_verification_checker.py check-freeze --root . --worktree docs/governance/audits/tdd/os007-os015-function-pair-freeze-2026-10-28.json",
      "python3 -B scaffold/tools/scfctl.py validate",
      "python3 -B scaffold/tools/scfctl.py stale",
      "git diff --check"
    ],
    "negative_cases": [
      "PR-B時点でL8の112 case refsは未割当。",
      "6 singleton-less classがL8/L9に不在で、negative-4wayはFAIL。",
      "PR-BではL9のL5 source pointerは残件であり、別PR-Cが2 pointerを追記する。",
      "旧freezeは成立せず、更新しない。"
    ]
  },
  "replacement": {
    "role_target": "OS015 L4/L9限定scaffold候補",
    "formal_artifacts": [],
    "issue": 0,
    "status": "pending",
    "transfer": null,
    "target_revisions": {},
    "confirmation_ref": null,
    "confirmation_digest": null
  },
  "created": "2026-10-30",
  "updated": "2026-10-30"
}
