{
  "schema_revision": 1,
  "id": "SCF-B-0188",
  "kind": "scaffold",
  "title": "WR219 F03 pair and trace source comparison",
  "product": "HELIX-HARNESS",
  "owner_candidate": "HELIX-HARNESS F03 pair/trace evidence review",
  "state": "registered",
  "reason": "固定blind導出と、固定baseのL4 class定義、L8/L9 synthetic期待、L9 projection invalidation auditの差異を証拠化する。正式sourceや分類値は変更せず、矛盾の解消判断もしない。",
  "upstream": [
    {
      "path": "docs/helix-harness/L3-requirements/functional-requirements.json",
      "sha256": "a3b907cdc316117d4684632f9a1cbf36125eb6e6172f9cfc286060617583d7be",
      "note": "Comparison checkout a0ce1ce787cff3b61664c12d62ae471969edb433 path digest for stale detection. Approved row bytes are pinned separately in comparison.json at revision 771dd7e802189506d88cf9d9570c42b94cf7b8fb."
    },
    {
      "path": "docs/helix-harness/L10-verification/functional-verification.json",
      "sha256": "fc58ad2268746d7924ac9be33e8f3f75e6d3c2cc619e27fbc1ddc34edd065cb2",
      "note": "Comparison checkout a0ce1ce787cff3b61664c12d62ae471969edb433 path digest for stale detection. Approved row bytes are pinned separately in comparison.json at revision 771dd7e802189506d88cf9d9570c42b94cf7b8fb."
    },
    {
      "path": "docs/helix-harness/L4-basic-design/process-state-port.json",
      "sha256": "2a4230d745cac2c9c9ee9500eba0efe028a16136bedd8b04b7d7d8f3eb382eb3",
      "note": "固定base a0ce1ce787cff3b61664c12d62ae471969edb433, /contracts/3の指定散文。 Historical fixed source: revision a0ce1ce787cff3b61664c12d62ae471969edb433, SHA-256 eb0f43e23906d04b9554786a2574c94d01de85faa75f7fb1f33e08eb3276f464. Current digest refreshed to 21f5f0837225fd1c50015528e27fb530f60b6d93046d17877b5655eb4e751a4a for stale detection only; fixed comparison/audit remains tied to the historical revision and its frozen evidence. comparison.json retains the fixed a0ce source digests/pointers, blind artifact digest, and audit values; no comparison artifact is rewritten. Current digest at WR227 R1 candidate: 21f5f0837225fd1c50015528e27fb530f60b6d93046d17877b5655eb4e751a4a (stale-detection pin only); historical fixed comparison source remains recorded above. Current digest after R1 compact evidence split: a81f0ae25d937ce9aea830d65f61fd5d04027511acb51ff39a0be526d8bba98a (stale-detection pin only; historical fixed audit/revision unchanged). Current digest after Japanese prose cleanup: d49a2f89364b5a031220ef515988b25d8e02c2894c2602ab7ea316b9ab394a67 (stale-detection pin only; historical fixed source/audit unchanged). Current digest after Japanese wording, unmatched-row clarification, and pointer-centered audit: 2a4230d745cac2c9c9ee9500eba0efe028a16136bedd8b04b7d7d8f3eb382eb3 (stale-detection pin only; historical fixed source/audit unchanged)."
    },
    {
      "path": "docs/helix-harness/L8-unit-verification/process-state-port.json",
      "sha256": "ee564c12ea81158f14a0483bd0fd4d9d35352b62c8050bdf8686195f32df213f",
      "note": "固定base / refs/heads/main a0ce1ce787cff3b61664c12d62ae471969edb433。F03 /cases/3/cases/4,6。"
    },
    {
      "path": "docs/helix-harness/L9-integration-verification/process-state-port.json",
      "sha256": "60942b72d432a79e72b03ab42a616e264b442bfc60b5d53e3aeb54f9c84a847e",
      "note": "固定base / refs/heads/main a0ce1ce787cff3b61664c12d62ae471969edb433。F03 /cases/3/negative_cases/0,2。 Historical fixed source: revision a0ce1ce787cff3b61664c12d62ae471969edb433, SHA-256 ccac38abfa3a204fdd1b5c325b67835e13957914f5a8f239e87efe55d190dff5. Current digest refreshed to 60942b72d432a79e72b03ab42a616e264b442bfc60b5d53e3aeb54f9c84a847e for stale detection only; fixed comparison/audit remains tied to the historical revision and its frozen evidence. comparison.json retains the fixed a0ce source digests/pointers, blind artifact digest, and audit values; no comparison artifact is rewritten."
    }
  ],
  "role": "WR219 F03のorigin-null / trace-empty synthetic witnessに関する固定blind derivationと既存L8/L9期待値の比較を保持する。",
  "obligations": [
    "固定blind artifact SHAとbyte一致を保持し、origin-null / trace-empty witnessを分けて記録する。",
    "L4 F03_REQUIRED_PAIR_MISSING のpair_trace/missing/HARNESS定義と、L8/L9 pair_result・valley_result・10観点のsynthetic supported期待を同じ行で比較する。",
    "L9 trace witnessのinvalidated_prior_candidate_codesと同一行のnegative_class_assignmentの両方を記録し、origin witnessの対応audit有無も記録する。",
    "相互に異なる値を保持し、正式source・expected・classificationを変更または成功へ置換しない。"
  ],
  "connections": {
    "consumers": [
      "WR219 F03 review evidence / GitHub Issue #3510"
    ],
    "dependencies": [
      "fixed blind artifact SHA-256 489d2aa4786436b7cfc10b3dc4be9f2c5019727c60291d82293822e341fe60e4",
      "approved L3/L10 F03 source rows",
      "L4/L8/L9 F03 source files",
      "all-negative inventory: Issue #3510 comment 6531272911 (linked from comparison.json)",
      "PR #3962 R1 review comment 6531673161 and response artifact"
    ],
    "boundary": "Scaffold evidence only. No canonical class membership, requirement meaning, design change, ticket issuance, reverse success, or acceptance is established."
  },
  "operations": {
    "allowed": [
      "Read pinned L3/L10 rows, L4 contract prose, and L8/L9 selected case expectations.",
      "Static revision, path, pointer, and SHA-256 comparison.",
      "python3 -m json.tool",
      "python3 -B scaffold/tools/scfctl.py validate",
      "git diff --check"
    ],
    "forbidden": [
      "Execute any embedded algorithm, legacy runtime, test, hook, CLI, or CI.",
      "Modify approved L3/L10 or existing L4/L8/L9 expected values, classifications, or meanings.",
      "Treat candidate annotation, synthetic expectation, or scaffold validation as approval, canonical taxonomy, or completion."
    ]
  },
  "artifacts": [
    "scaffold/research/wr219-f03-pair-blind-20261031/README.md",
    "scaffold/research/wr219-f03-pair-blind-20261031/blind-derivation.json",
    "scaffold/research/wr219-f03-pair-blind-20261031/comparison.json",
    "scaffold/bindings/SCF-B-0188.json",
    "scaffold/research/wr219-f03-pair-blind-20261031/wr224-independent-blind-derivation.json",
    "scaffold/research/wr219-f03-pair-blind-20261031/wr224-comparison-after-r1.md",
    "scaffold/research/wr219-f03-pair-blind-20261031/wr227-f03-value-domain-audit.json",
    "scaffold/research/wr186-psp-negative-residual/validate_l9.py"
  ],
  "verification": {
    "evidence_kind": "scaffold",
    "scope": [
      "schema_interface",
      "source_revision_stale",
      "negative_case",
      "forbidden_write_scope"
    ],
    "oracles": [
      "python3 -m json.tool on blind-derivation.json, comparison.json, and SCF-B-0188.json",
      "SHA-256 of blind-derivation.json equals fixed source artifact SHA-256 489d2aa4786436b7cfc10b3dc4be9f2c5019727c60291d82293822e341fe60e4",
      "SHA-256 of comparison.json: 5a9881dcad1e4fcd3460eb57d4878f41a469e39940042550b9c2befe69587b49",
      "python3 -B scaffold/tools/scfctl.py validate",
      "python3 -B scaffold/tools/scfctl.py stale",
      "git diff --check",
      "SHA-256 of scaffold/research/wr219-f03-pair-blind-20261031/wr224-independent-blind-derivation.json equals c363ed8bfbf87130be01506092c91d6058c1ffb84452b00fc75cf578f5f79ef5 (byte copy of fixed Issue #3510 comment 6532068000 blind artifact).",
      "SHA-256 of scaffold/research/wr219-f03-pair-blind-20261031/wr224-comparison-after-r1.md equals 3f978848e4b60d4b5c7da027b9b3ee31dd7d44b85318a0e8f49a3ad6a652006b (comparison to fixed blind and PR #3970 R1 findings).",
      "SHA-256 of scaffold/research/wr219-f03-pair-blind-20261031/wr227-f03-value-domain-audit.json equals 754c9aa9fdfa8f21e823366c3a17d3a26c4a3598a77d64f271bf75f7f45d5e88 (scaffold-only exhaustive row/count/exception evidence).",
      "SHA-256 of scaffold/research/wr186-psp-negative-residual/validate_l9.py equals 5fc0f7342c17457e54da021e85288f411d0daa70d08e26ff57e2488075af771a (static row, count, exception, and historical L9 reason audit)."
    ],
    "negative_cases": [
      "Do not replace L4 state=missing with a supported/success value, or treat L8/L9 supported_synthetic_condition as actual pair success.",
      "Keep the L9 trace projection audit invalidation and same-row retained assignment distinct; do not infer an equivalent origin invalidation without a matching record.",
      "Do not rewrite L4/L8/L9 formal values while recording unresolved source disagreement.",
      "Do not run L4/L5 algorithms, old runtime, tests, or CI."
    ]
  },
  "replacement": {
    "role_target": null,
    "formal_artifacts": [],
    "issue": 3510,
    "status": "pending",
    "transfer": null,
    "target_revisions": {},
    "confirmation_ref": null,
    "confirmation_digest": null
  },
  "created": "2026-10-31",
  "updated": "2026-10-31"
}
