{
  "schema_revision": 1,
  "id": "SCF-B-0179",
  "kind": "scaffold",
  "title": "WR198 F05 owner source search record",
  "product": "HELIX-HARNESS",
  "owner_candidate": "HELIX-HARNESS CORE009 F05 source investigation",
  "state": "registered",
  "reason": "WR198-F05-GAP-PROPOSAL-BODY-SOURCE（Issue #3510）のdesign_verification依頼に基づき、既存Stopと期待を変えず、調査対象・参照revision・検索範囲・結果・再調査条件を記録する。独立owner statement/body、有限L9 oracle、新要求を形成しない。",
  "upstream": [
    {
      "path": "docs/helix-harness/L3-requirements/functional-requirements.json",
      "sha256": "a3b907cdc316117d4684632f9a1cbf36125eb6e6172f9cfc286060617583d7be",
      "note": "HARNESS-009-F05 /requirements/27。scopeとsource保持の既存意味を照合。"
    },
    {
      "path": "docs/helix-harness/L10-verification/functional-verification.json",
      "sha256": "fc58ad2268746d7924ac9be33e8f3f75e6d3c2cc619e27fbc1ddc34edd065cb2",
      "note": "HARNESS-009-F05 /cases/27。既存verification意味を照合。"
    },
    {
      "path": "docs/helix-harness/L4-basic-design/product-template-application.json",
      "sha256": "009da68d79547770e32a91362a410e014ed1951e0cfe9f67a6f6b31fd4c16824",
      "note": "既存gap_proposition_body guardを参照。変更なし。"
    },
    {
      "path": "docs/helix-harness/L9-integration-verification/product-template-application.json",
      "sha256": "4d94e1d4e98c69dbad830b9bb699cdebaab2b8ad51e24e6733ef8b798ad35cef",
      "note": "case HARNESS-L9-009-F05-EVIDENCE-QUESTION-CONTRACTと既存Stopを参照。変更なし。"
    },
    {
      "path": "docs/governance/decisions/helix-harness-core009-prerequisite-l3-l10-delegated-decision-2026-10-12.md",
      "sha256": "341a12c73079aa57d16a3e8d164d23d29a0d375caf2bfd8a8f53b8b5123ff108",
      "note": "WR198 authority context; decision text and L3/L10 meaning are not changed."
    },
    {
      "path": "docs/helix-brain/L1-planning/brain-intent.md",
      "sha256": "2674b2e1a770a038b2d53a93ca635a0cbbfca42af463a562f22e1c51d5ebb5f0",
      "note": "BRAIN system-intent context checked for same-scope owner statement; not identified as such."
    },
    {
      "path": "docs/helix-brain/L2-requirements/brain-requirements.md",
      "sha256": "ef41de572d35912a0345dad2960a3ae7015ca5434d67247503785b9f65e8346c",
      "note": "BRAIN requirement context checked; no CORE009 F05 owner body identified."
    },
    {
      "path": "docs/helix-brain/L3-requirements/functional-requirements.json",
      "sha256": "2b91a5c1c7d41bdccbb069d82a732bb37ac67f94230c406378edef3af944500b",
      "note": "BRAIN requirement context checked; no CORE009 F05 owner body identified."
    },
    {
      "path": "docs/helix-brain/L10-verification/functional-verification.json",
      "sha256": "3308209af9d6b1556e164639b197dd4f4f0ab6753cdccb55698e1b464a755c7a",
      "note": "BRAIN verification context checked; no CORE009 F05 finite oracle identified."
    },
    {
      "path": "archive/legacy-generation-2026-09-14/root/docs/design/helix/L4-basic-design/design-template-json-authority.md",
      "sha256": "e254d995d1d9fbbcc74bb53b3356b4499ac20cca2280eeafde1412d08630c4cb",
      "note": "LEGACY-ASSET-4F5A1F0739EC1111D91D, lines 16-60,81-92。静的read-only参照のみ。"
    },
    {
      "path": "archive/legacy-generation-2026-09-14/root/docs/design/helix/L5-detail/design-template-json-authority.md",
      "sha256": "3015d4f3d65cd1f8205f88f29dd59c4f1f7ef42c729d8144f2319e49fe20d830",
      "note": "LEGACY-ASSET-98372FEE8A3AC8F9C299, lines 33-108。静的read-only参照のみ。"
    },
    {
      "path": "archive/legacy-generation-2026-09-14/root/docs/governance/predecessor-harness-full-weakness-audit-2026-07-20.md",
      "sha256": "bab121404c956a0a4b403e589bea1c414af59b5996989bea5fab9f98f42f6872",
      "note": "LEGACY-ASSET-A127DEC3EEE6ED63CF17, UTW-014/020/021 at lines 80,86-87。静的read-only参照のみ。"
    }
  ],
  "role": "WR198で調査したowner sourceの所在・revision・検索境界・結果・再調査条件を、Stop維持のscaffold証跡として保持する。",
  "obligations": [
    "独立owner statement/body、同一scopeのoperand/basis sourceを確認できなかった検索範囲と限定的な結果を記録する。",
    "既存L4/L9 Stopと期待、HARNESS L3/L10の意味を変更しない。",
    "未発見を絶対的不在と断定せず、synthetic fixtureや一般的L9期待から有限oracleを形成しない。",
    "旧L4/L5資産とUTW-014/020/021を照合し、失敗監査を新要求や成功条件へ転用しない。",
    "再調査に必要なowner source、revision/pointer、scope、body/operand/basis対応を明示する。"
  ],
  "connections": {
    "consumers": [
      "HARNESS-009 F05 L4/L9 design_verification investigation"
    ],
    "dependencies": [
      "WR198-F05-GAP-PROPOSAL-BODY-SOURCE request (Issue #3510; request SHA-256 in README)",
      "HARNESS L3 /requirements/27 and L10 /cases/27",
      "CORE009 prerequisite L3/L10 delegated decision",
      "Existing L4 gap_proposition_body guard and L9 case 4"
    ],
    "boundary": "scaffold evidence only; no authority effect, requirement change, finite L9 oracle, runtime behavior, implementation completion, or freeze claim."
  },
  "operations": {
    "allowed": [
      "read-only source/hash/pointer inspection",
      "repository text search within the documented scope",
      "scfctl validate/stale",
      "design_verification_checker.py check-child/check-freeze as static measurement",
      "git diff --check",
      "python3 -m json.tool <changed-json>"
    ],
    "forbidden": [
      "L3/L10 semantics, L4 guard, L9 input/expected, or existing Stop changes",
      "creating owner body, proposal classification, Cause, or finite expected from metadata/fixtures",
      "old HELIX CLI/hook/runtime/test/CI execution",
      "旧archiveは実行しない",
      "runtime, tests, CI, freeze generation, or claiming pair completion"
    ]
  },
  "artifacts": [
    "scaffold/research/wr198-f05-owner-source-audit-20261031/README.md",
    "scaffold/bindings/SCF-B-0179.json"
  ],
  "verification": {
    "evidence_kind": "scaffold",
    "scope": [
      "schema_interface",
      "source_revision_stale",
      "negative_case",
      "forbidden_write_scope"
    ],
    "oracles": [
      "python3 -m json.tool scaffold/bindings/SCF-B-0178.json",
      "python3 -B scaffold/tools/scfctl.py validate",
      "python3 -B scaffold/tools/scfctl.py stale",
      "python3 scaffold/tools/design_verification_checker.py check-child --root . --l4 docs/helix-harness/L4-basic-design/product-template-application.json --l9 docs/helix-harness/L9-integration-verification/product-template-application.json --l5 docs/helix-harness/L5-detail-design/product-template-application.json --l8 docs/helix-harness/L8-unit-verification/product-template-application.json",
      "python3 scaffold/tools/design_verification_checker.py check-freeze --root . --worktree docs/governance/audits/tdd/h009-fn5-function-pair-freeze-2026-10-28.json",
      "python3 scaffold/tools/design_verification_checker.py check-freeze --root . --worktree docs/governance/audits/tdd/h009-fn5-application-contract-recipient-refreeze-2026-10-29.json",
      "python3 scaffold/tools/design_verification_checker.py check-freeze --root . --worktree docs/governance/audits/tdd/h009-fn5-source-content-failure-writer-pr-candidate-freeze-2026-10-29.json",
      "git diff --check"
    ],
    "negative_cases": [
      "No qualifying same-scope owner statement/body located within the documented search; this bounded result is not proof of global absence.",
      "Body-entry absence and proposal-body-oracle Stops remain unchanged; no Cause or classification is fabricated.",
      "No L9 input/expected is authored from existing producer fixtures, design descriptions, or generic L3/L10 wording.",
      "Existing freeze checker SHA mismatches, if unchanged from baseline, are pre-existing observations and are not claimed as a pass or resolved by this scaffold record."
    ]
  },
  "replacement": {
    "role_target": "正式な設計検証機構における、owner sourceの探索境界と再調査条件の記録",
    "formal_artifacts": [],
    "issue": 1866,
    "status": "pending"
  },
  "created": "2026-10-31",
  "updated": "2026-10-31"
}
